{
  "api_schema_version": "1.0",
  "run_id": "0123456789abcdef0123456789abcdef",
  "snapshot_hash": "3a19a02771069e3890443aacdc3bc2a1cd8b63bef71a248c4b96a71ddaf0353a",
  "created_at": "2026-10-20T12:00:00Z",
  "source": "SIM",
  "run": {
    "mode": "desk",
    "seed": 20201020,
    "paths": 1000,
    "preview": true,
    "horizon_days": 21,
    "step": "daily"
  },
  "model_card": {
    "model_card_schema_version": "1.0",
    "model_version": "fixture-1",
    "snapshot_hash": "3a19a02771069e3890443aacdc3bc2a1cd8b63bef71a248c4b96a71ddaf0353a",
    "profile_name": "default",
    "profile_hash": "f64e4e3cfcbef5ca008886d2646a493b5bfe32a1f2ad38a35d8f72bdc4455f13",
    "mode": "desk",
    "seed": 20201020,
    "paths": 1000,
    "preview": true,
    "horizon_days": 21,
    "step": "daily",
    "convergence": {
      "checked": false,
      "max_shift_in_standard_errors": null,
      "passed": null
    },
    "validation": [
      {
        "check": "contract fixture only",
        "passed": true,
        "note": "Shape example; not model output."
      }
    ],
    "data_label": "SIM",
    "limitations": "Synthetic data and illustrative parameters. Shape example only; not evidence of real-world risk."
  },
  "effective_settings": [
    {
      "position_id": "L1",
      "kind": "loan",
      "mpor_days": 5,
      "settings": {
        "mpor_liquid_days": 5,
        "mpor_other_days": 10,
        "mpor_concentrated_days": 10,
        "mpor_pool_forced_sale_days": 5,
        "mpor_fixed_days": null,
        "addon_days": 0,
        "concentration_threshold_pct_adv": 25,
        "htb_uses_concentrated_period": true,
        "impact_k": 0.5,
        "impact_alpha": 0.5,
        "half_spread_floor_bps": 0,
        "cost_cap_bps": null,
        "stress_beta": 0,
        "stress_factor": "equity",
        "unwind": "end_of_period",
        "margin_call_every_days": 1
      },
      "source_levels": {
        "mpor_liquid_days": "default",
        "mpor_other_days": "default",
        "mpor_concentrated_days": "default",
        "mpor_pool_forced_sale_days": "default",
        "mpor_fixed_days": "default",
        "addon_days": "default",
        "concentration_threshold_pct_adv": "default",
        "htb_uses_concentrated_period": "default",
        "impact_k": "default",
        "impact_alpha": "default",
        "half_spread_floor_bps": "default",
        "cost_cap_bps": "default",
        "stress_beta": "default",
        "stress_factor": "default",
        "unwind": "default",
        "margin_call_every_days": "default"
      }
    },
    {
      "position_id": "L2",
      "kind": "loan",
      "mpor_days": 5,
      "settings": {
        "mpor_liquid_days": 5,
        "mpor_other_days": 10,
        "mpor_concentrated_days": 10,
        "mpor_pool_forced_sale_days": 5,
        "mpor_fixed_days": null,
        "addon_days": 0,
        "concentration_threshold_pct_adv": 25,
        "htb_uses_concentrated_period": true,
        "impact_k": 0.5,
        "impact_alpha": 0.5,
        "half_spread_floor_bps": 0,
        "cost_cap_bps": null,
        "stress_beta": 0,
        "stress_factor": "equity",
        "unwind": "end_of_period",
        "margin_call_every_days": 1
      },
      "source_levels": {
        "mpor_liquid_days": "default",
        "mpor_other_days": "default",
        "mpor_concentrated_days": "default",
        "mpor_pool_forced_sale_days": "default",
        "mpor_fixed_days": "default",
        "addon_days": "default",
        "concentration_threshold_pct_adv": "default",
        "htb_uses_concentrated_period": "default",
        "impact_k": "default",
        "impact_alpha": "default",
        "half_spread_floor_bps": "default",
        "cost_cap_bps": "default",
        "stress_beta": "default",
        "stress_factor": "default",
        "unwind": "default",
        "margin_call_every_days": "default"
      }
    },
    {
      "position_id": "L3",
      "kind": "loan",
      "mpor_days": 5,
      "settings": {
        "mpor_liquid_days": 5,
        "mpor_other_days": 10,
        "mpor_concentrated_days": 10,
        "mpor_pool_forced_sale_days": 5,
        "mpor_fixed_days": null,
        "addon_days": 0,
        "concentration_threshold_pct_adv": 25,
        "htb_uses_concentrated_period": true,
        "impact_k": 0.5,
        "impact_alpha": 0.5,
        "half_spread_floor_bps": 0,
        "cost_cap_bps": null,
        "stress_beta": 0,
        "stress_factor": "equity",
        "unwind": "end_of_period",
        "margin_call_every_days": 1
      },
      "source_levels": {
        "mpor_liquid_days": "default",
        "mpor_other_days": "default",
        "mpor_concentrated_days": "default",
        "mpor_pool_forced_sale_days": "default",
        "mpor_fixed_days": "default",
        "addon_days": "default",
        "concentration_threshold_pct_adv": "default",
        "htb_uses_concentrated_period": "default",
        "impact_k": "default",
        "impact_alpha": "default",
        "half_spread_floor_bps": "default",
        "cost_cap_bps": "default",
        "stress_beta": "default",
        "stress_factor": "default",
        "unwind": "default",
        "margin_call_every_days": "default"
      }
    }
  ],
  "program": {
    "gaussian": {
      "with_wrong_way": {
        "total": {
          "el": {
            "value": 1000.0,
            "std_error": 50.0
          },
          "epe": {
            "value": 15000.0,
            "std_error": 750.0
          },
          "pfe95": {
            "value": 90000.0,
            "std_error": 4500.0
          },
          "pfe99": {
            "value": 150000.0,
            "std_error": 7500.0
          },
          "var99": {
            "value": 120000.0,
            "std_error": 6000.0
          },
          "var999": {
            "value": 260000.0,
            "std_error": 13000.0
          },
          "es99": {
            "value": 180000.0,
            "std_error": 9000.0
          },
          "es999": {
            "value": 300000.0,
            "std_error": 15000.0
          }
        },
        "default_shortfall": {
          "el": {
            "value": 700.0,
            "std_error": 35.0
          },
          "epe": {
            "value": 10500.0,
            "std_error": 525.0
          },
          "pfe95": {
            "value": 63000.0,
            "std_error": 3150.0
          },
          "pfe99": {
            "value": 105000.0,
            "std_error": 5250.0
          },
          "var99": {
            "value": 84000.0,
            "std_error": 4200.0
          },
          "var999": {
            "value": 182000.0,
            "std_error": 9100.0
          },
          "es99": {
            "value": 126000.0,
            "std_error": 6300.0
          },
          "es999": {
            "value": 210000.0,
            "std_error": 10500.0
          }
        },
        "reinvestment": {
          "el": {
            "value": 300.0,
            "std_error": 15.0
          },
          "epe": {
            "value": 4500.0,
            "std_error": 225.0
          },
          "pfe95": {
            "value": 27000.0,
            "std_error": 1350.0
          },
          "pfe99": {
            "value": 45000.0,
            "std_error": 2250.0
          },
          "var99": {
            "value": 36000.0,
            "std_error": 1800.0
          },
          "var999": {
            "value": 78000.0,
            "std_error": 3900.0
          },
          "es99": {
            "value": 54000.0,
            "std_error": 2700.0
          },
          "es999": {
            "value": 90000.0,
            "std_error": 4500.0
          }
        }
      },
      "without_wrong_way": {
        "total": {
          "el": {
            "value": 800.0,
            "std_error": 40.0
          },
          "epe": {
            "value": 12000.0,
            "std_error": 600.0
          },
          "pfe95": {
            "value": 72000.0,
            "std_error": 3600.0
          },
          "pfe99": {
            "value": 120000.0,
            "std_error": 6000.0
          },
          "var99": {
            "value": 96000.0,
            "std_error": 4800.0
          },
          "var999": {
            "value": 208000.0,
            "std_error": 10400.0
          },
          "es99": {
            "value": 144000.0,
            "std_error": 7200.0
          },
          "es999": {
            "value": 240000.0,
            "std_error": 12000.0
          }
        },
        "default_shortfall": {
          "el": {
            "value": 560.0,
            "std_error": 28.0
          },
          "epe": {
            "value": 8400.0,
            "std_error": 420.0
          },
          "pfe95": {
            "value": 50400.0,
            "std_error": 2520.0
          },
          "pfe99": {
            "value": 84000.0,
            "std_error": 4200.0
          },
          "var99": {
            "value": 67200.0,
            "std_error": 3360.0
          },
          "var999": {
            "value": 145600.0,
            "std_error": 7280.0
          },
          "es99": {
            "value": 100800.0,
            "std_error": 5040.0
          },
          "es999": {
            "value": 168000.0,
            "std_error": 8400.0
          }
        },
        "reinvestment": {
          "el": {
            "value": 240.0,
            "std_error": 12.0
          },
          "epe": {
            "value": 3600.0,
            "std_error": 180.0
          },
          "pfe95": {
            "value": 21600.0,
            "std_error": 1080.0
          },
          "pfe99": {
            "value": 36000.0,
            "std_error": 1800.0
          },
          "var99": {
            "value": 28800.0,
            "std_error": 1440.0
          },
          "var999": {
            "value": 62400.0,
            "std_error": 3120.0
          },
          "es99": {
            "value": 43200.0,
            "std_error": 2160.0
          },